StartDate,EndDate,Status,IPAddress,Progress,Duration (in seconds),Finished,RecordedDate,ResponseId,RecipientLastName,RecipientFirstName,RecipientEmail,ExternalReference,LocationLatitude,LocationLongitude,DistributionChannel,UserLanguage,Q79,Q80,Q81, IL1 NL_1, IL1 NL_2, IL1 NL_3, IL1 NL_4, IL1 NL_5, IL1 NL_6, IL1 NL_7, IL1 NL_8, IL1 NL_9,IL2 NL_1,IL2 NL_2,IL2 NL_3,IL 3 NL_1,IL 3 NL_2,IL 3 NL_3,IL 4 NL_1,IL 4 NL_2,IL 4 NL_3,IL 4 NL_4,IL 4 NL_5,IL5 NL_1,IL5 NL_2,IL6 NL_1,IL6 NL_2,IL6 NL_3,TL1 NL_1,TL1 NL_2,TL1 NL_3,TL1 NL_4,TL1 NL_5,TL1 NL_6,TL1 NL_7,TL2 NL_1,TL2 NL_2,TL2 NL_3,TL3 NL_1,TL3 NL_2,TL4 NL_1,TL4 NL_2,OL1  NL_1,OL1  NL_2,OL1  NL_3,OL1  NL_4,OL1  NL_5,OL1  NL_6,OL1  NL_7,OL 2 NL_1,OL3 NL_1,OL3 NL_2,OL3 NL_3,OL4 NL_1,OL4 NL_2,OL4 NL_3,OL6 NL_1,OL6 NL_2,OL7 NL_1,OL7 NL_2,OL7 NL_3,OL7 NL_4,OL7 NL_5,OL7 NL_6,NL 1 NL_1,NL 1 NL_2,NL 1 NL_3,NL 1 NL_4,NL 1 NL_5,NL 1 NL_6,NL 1 NL_7,NL2 NL_1,NL2 NL_2,NL2 NL_3,NL2 NL_4,NL3 NL_1,NL3 NL_1_TEXT,NL3 NL_2,NL3 NL_3,NL3 NL_4,NL3 NL_5,NL3 NL_6,NL3 NL_7,NL3 NL_8,NL3 NL_9,NL3 NL_10,NL3 NL_11,IL1 EN_1,IL1 EN_2,IL1 EN_3,IL1 EN_4,IL1 EN_5,IL1 EN_6,IL1 EN_7,IL1 EN_8,IL1 EN_9,IL2 EN_1,IL2 EN_2,IL2 EN_3,IL3 EN_1,IL3 EN_2,IL3 EN_3,IL 4 EN_1,IL 4 EN_2,IL 4 EN_3,IL 4 EN_4,IL 4 EN_5,IL5 EN_1,IL5 EN_2,IL6 EN _1,IL6 EN _2,IL6 EN _3,TL1 EN_1,TL1 EN_2,TL1 EN_3,TL1 EN_4,TL1 EN_5,TL1 EN_6,TL1 EN_7,TL2 EN_1,TL2 EN_2,TL2 EN_3,TL3 EN_1,TL3 EN_2,TL3 EN_3,TL4 EN_1,TL4 EN_2,OL1 EN_1,OL1 EN_2,OL1 EN_3,OL1 EN_4,OL1 EN_5,OL1 EN_6,OL1 EN_7,OL2 EN_1,OL3 EN_1,OL3 EN_2,OL3 EN_3,OL4 EN_1,OL4 EN_2,OL4 EN_3,OL6 EN_1,OL6 EN_2,OL7 EN_1,OL7 EN_2,OL7 EN_3,OL7 EN_4,OL7 EN_5,OL7 EN_6,NL1 EN_1,NL1 EN_2,NL1 EN_3,NL1 EN_4,NL1 EN_5,NL1 EN_6,NL1 EN_7,NL2 EN_1,NL2 EN_2,NL2 EN_3,NL2 EN_4,NL2 EN_5,NL2 EN_6,NL3 EN_1,NL3 EN_2,NL3 EN_3,NL3 EN_4,NL3 EN_5,NL3 EN_6,NL3 EN_7,NL3 EN_8,NL3 EN_9,NL3 EN_10,NL3 EN_11,Informed consent-NL,RBP16 NL,RBP17 NL,RBP 18 NL,RBP1 NL,RBP4 NL,RBP5 NL,RBP6 NL,RBP7 NL,RBP18 NL,RBP9 NL,RBP10 NL,RBP12 NL,RB13 NL,Informed Consent EN,RBP16 EN,RBP18 EN,RBP1 EN,RBP4 EN,RBP5 EN,RBP6 EN,RBP7 EN,RBP8 EN,RBP9 EN,RBP10 EN,RB11 EN,RBP12 EN,RBP13 EN
Start Date,End Date,Response Type,IP Address,Progress,Duration (in seconds),Finished,Recorded Date,Response ID,Recipient Last Name,Recipient First Name,Recipient Email,External Data Reference,Location Latitude,Location Longitude,Distribution Channel,User Language,Language/Taal,"Bedankt voor uw deelname aan dit onderzoek.



De digitale-creatieve sector is een belangrijke sector voor de Nederlandse economie die mede door COVID19 een stormachtige ontwikkeling doormaakt. Recente ontwikkelingen hebben aangetoond dat het kunnen omgaan met veranderingen meer dan ooit een belangrijke ondernemerscompetentie is. 
Met het onderzoek ‘Versterking van Veerkracht van de Creatieve industrie’ (Verveci) wil Breda University of Applied Sciences (BUas) inzicht verkrijgen in de factoren die bepalen in welke mate en op welke wijze bedrijven in de digitale-creatieve industrie doorgroeien en zich aanpassen - kortom Veerkrachtig zijn.



Uw antwoorden zullen bijdragen aan het verder versterken van de veerkracht van de Nederlandse creatieve industrie. Beoogde resultaten voor de creatieve industrie zijn een (online) instrument om de veerkracht van ondernemingen in de creatieve industrie te benchmarken en een instrumentarium dat ondernemers helpt hun veerkracht te versterken.







Het project is gefinancierd door Regieorgaan SIA binnen het RAAK-mkb programma en wordt in samenwerking met Tilburg University uitgevoerd binnen het Lectoraat Serious Games van Dr. Igor Mayer. Ook uw organisatie heeft direct baat bij dit onderzoek, aangezien wij op verzoek uw scores kunnen vergelijken met relevante collega bedrijven binnen uw branche. Als uw medewerkers meedoen, kunnen wij een benchmark maken tussen uw medewerkersscores en het management.



We verwachten dat dit onderzoek ongeveer 20 minuten zal duren. Onder de deelnemers verloten we een tiental dinerbonnen voor Sibelisious, het restaurant van de hotelschool van Breda University of Applied Sciences. Indien u nadere informatie wenst te ontvangen over uw score en de benchmark vul dan svp hieronder uw e-mail adres in.","Thanks for participating in this survey.



The digital creative sector is an important sector for the Dutch economy. Recent developments, like Covid, have shown that being able to cope with change is more than ever an important entrepreneurial competence. With the research 'Strengthening Resilience of the Dutch Creative Industries' (Verveci), Breda University of Applied Sciences (BUas) wants to gain insight into the factors that determine to what extent and in which way companies in the digital creative industry continue to grow and adapt - in short, being resilient.


Your organization can benefit from comparison your opinion about resilience with that of your colleagues or employees. Intended results for the creative industry are an (online) tool to benchmark the resilience of companies in the creative industry and a toolbox that helps entrepreneurs to strengthen their resilience. The project is financed by Regieorgaan SIA within the RAAK-mkb program and is being carried out in collaboration with Tilburg University within the Serious Games Lectorate of Dr. Igor Mayer. Project leaders are Hans de Nie, Ma and Dr. Frank Peters.








Your organization will also benefit directly from this survey, as we can compare your scores with relevant companies in your industry on request. If your employees participate, we can benchmark your employee scores and management. We expect this investigation to take approximately 20 minutes. We raffle ten dinner vouchers among the participants for Sibelicious, the restaurant of the hotel school of Breda University of Applied Sciences. If you want to receive more information on your scores and the benchmark, please enter you e-mail address below",Veerkracht factoren op individueel niveau. Geef svp aan in hoeverre u het ermee eens of oneens bent: - (IL1.1) Werkeisen: Ik voel me regelmatig uitgeput na een werkweek.,Veerkracht factoren op individueel niveau. Geef svp aan in hoeverre u het ermee eens of oneens bent: - (IL1.1) Burn-out percentage: In onze organisatie heerst een prettig werkklimaat.,Veerkracht factoren op individueel niveau. Geef svp aan in hoeverre u het ermee eens of oneens bent: - (IL1.2) Stressoren: Ik voel regelmatig onzekerheid over mijn baan.,Veerkracht factoren op individueel niveau. Geef svp aan in hoeverre u het ermee eens of oneens bent: - (IL1.2) Stressoren: Ik voel druk om buiten werktijd te werken en voel me niet vrij om mijn werk op een normaal tijdstip te verlaten.,Veerkracht factoren op individueel niveau. Geef svp aan in hoeverre u het ermee eens of oneens bent: - (IL1.2) Stressoren: In onze organisatie heerst een competitieve cultuur.,Veerkracht factoren op individueel niveau. Geef svp aan in hoeverre u het ermee eens of oneens bent: - (IL1.3) Werk: Ik zie veel mogelijkheden voor persoonlijke groei.,Veerkracht factoren op individueel niveau. Geef svp aan in hoeverre u het ermee eens of oneens bent: - (IL1.3) Werk: In onze organisatie krijg ik regelmatig constructieve feedback.,Veerkracht factoren op individueel niveau. Geef svp aan in hoeverre u het ermee eens of oneens bent: - (IL1.3) Werk: In onze organisatie heb ik veel verschillende vaardigheden die ik in mijn werk kan gebruiken.,Veerkracht factoren op individueel niveau. Geef svp aan in hoeverre u het ermee eens of oneens bent: - (IL1.3) Werk: Binnen onze organisatie voel ik veel vrijheid om mijn taken uit te voeren.,"Individueel niveau. Geef svp aan in hoeverre u het ermee eens of oneens bent - (IL2.1) Persoonlijkheidskenmerken: Ik heb een gezond gevoel voor humor, dit helpt om rustig te blijven in moeilijke omstandigheden.","Individueel niveau. Geef svp aan in hoeverre u het ermee eens of oneens bent - (IL2.1) Persoonlijkheidskenmerken: Ik heb een optimistische instelling, dit helpt om rustig te blijven in moeilijke omstandigheden.",Individueel niveau. Geef svp aan in hoeverre u het ermee eens of oneens bent - (IL2.1) Persoonlijkheidskenmerken: In stressvolle situaties durf ik mijn mening te geven.,Individueel niveau. Geef svp aan in hoeverre u het ermee eens of oneens bent - (IL3.1) Sociale vaardigheden: Ik voel me prettig bij het onderhouden van mijn sociale netwerk binnen en buiten het bedrijf.,Individueel niveau. Geef svp aan in hoeverre u het ermee eens of oneens bent - (IL3.2) Cognitieve vaardigheden: Ik ben in staat de kennisontwikkeling in mijn beroep bij te houden.,Individueel niveau. Geef svp aan in hoeverre u het ermee eens of oneens bent - (IL3.3) Professionele vaardigheden: Ik vind dat ik de tijd heb om mijn taken uit te voeren.,Individueel niveau. Geef svp aan in hoeverre u het ermee eens of oneens bent - (IL4.1) Zingeving: Ik heb het gevoel dat ik bijdraag aan het algemene succes van het bedrijf.,Individueel niveau. Geef svp aan in hoeverre u het ermee eens of oneens bent - (IL4.2) Dankbaarheid: Ik heb het gevoel dat ik erkenning krijg van mijn organisatie voor mijn werk.,Individueel niveau. Geef svp aan in hoeverre u het ermee eens of oneens bent - (IL4.3) Bescheidenheid: Ik vind dat we allemaal even belangrijk zijn voor het succes van het bedrijf.,Individueel niveau. Geef svp aan in hoeverre u het ermee eens of oneens bent - (IL4.4) Hoop: Ik geloof dat ons bedrijf een voorspoedige toekomst tegemoet gaat.,Individueel niveau. Geef svp aan in hoeverre u het ermee eens of oneens bent - (IL4.5) Loopbaanoriëntatie: Ik ben gericht op mijn persoonlijke loopbaanontwikkeling.,Individueel niveau. Geef svp aan in hoeverre u het ermee eens of oneens bent - (IL5.1) Positieve relaties / vertrouwen / samenwerking: Ik vertrouw mijn collega's en werk graag samen.,Individueel niveau. Geef svp aan in hoeverre u het ermee eens of oneens bent - (IL5.2) Sociale steun uit de privé-omgeving: Ik heb het gevoel dat mijn familie/vrienden mij steunen in mijn carrière.,Individueel niveau. Geef svp aan in hoeverre u het ermee eens of oneens bent - (IL6.1) Een positieve werkomgeving creëren: De bedrijfsleider/manager is in staat om een positieve werkomgeving te creëren.,Individueel niveau. Geef svp aan in hoeverre u het ermee eens of oneens bent - (IL6.2) Alternatieve strategieën introduceren: De bedrijfsleider/manager is in staat om alternatieve strategieën te bedenken wanneer we met moeilijkheden te maken krijgen.,Individueel niveau. Geef svp aan in hoeverre u het ermee eens of oneens bent - (IL6.3) Het vermogen om passende strategieën te kiezen: De bedrijfsleider/manager is in staat om de juiste strategie te kiezen bij bedreigingen of grote veranderingen in ons bedrijf.,Veerkracht factoren team niveau. Geef svp aan in hoeverre u het ermee eens of oneens bent - (TL1.1) Collectieve positieve emoties: Mijn team bekijkt het leven altijd van de zonnige kant.,Veerkracht factoren team niveau. Geef svp aan in hoeverre u het ermee eens of oneens bent - (TL1.2) Gedeelde overtuigingen: In mijn team hebben we een gedeelde visie in lijn met de bedrijfsdoelstellingen.,Veerkracht factoren team niveau. Geef svp aan in hoeverre u het ermee eens of oneens bent - (TL1.3) Cultuur van genieten: In mijn team weten we ook hoe we samen kunnen genieten.,Veerkracht factoren team niveau. Geef svp aan in hoeverre u het ermee eens of oneens bent - (TL1.4) Cohesie: In mijn team hebben we een sterke band.,Veerkracht factoren team niveau. Geef svp aan in hoeverre u het ermee eens of oneens bent - (TL1.5) Samenwerking: In mijn team hebben we een gedeelde verantwoordelijkheid voor de resultaten.,Veerkracht factoren team niveau. Geef svp aan in hoeverre u het ermee eens of oneens bent - (TL1.6) Creatieve probleemoplossing: In mijn team zijn we in staat om creatieve oplossingen te bedenken.,Veerkracht factoren team niveau. Geef svp aan in hoeverre u het ermee eens of oneens bent - (TL1.7) Structuur: Wij hebben een team met een duidelijke geformaliseerde taakverdeling en een kwaliteitscontrolesysteem.,Team niveau. Geef svp aan in hoeverre u het ermee eens of oneens bent - (TL2.1) Sociale ondersteuning: In mijn team is het veilig om hulp te vragen. Deze cultuur wordt actief ondersteund.,Team niveau. Geef svp aan in hoeverre u het ermee eens of oneens bent - (TL2.3) Collectief omgaan met tegenspoed en tegenslag: In mijn team gaan we collectief om met problemen en uitdagingen.,"Team niveau. Geef svp aan in hoeverre u het ermee eens of oneens bent - (TL2.4) In mijn team hebben we vaste normen, checklists, handleidingen, hulpmiddelenmatrices en debriefings.",Team niveau. Geef svp aan in hoeverre u het ermee eens of oneens bent - (TL3.3) Complementariteit van vaardigheden: In mijn team hebben we alle vaardigheden die nodig zijn om een taak uit te voeren.,Team niveau. Geef svp aan in hoeverre u het ermee eens of oneens bent - (TL3.4) Creatief vermogen: In mijn team zijn we creatief en inspireren we elkaar.,Team niveau. Geef svp aan in hoeverre u het ermee eens of oneens bent - (TL4.1) Aanbod van adequate hulpmiddelen en training: Onze teamleider zorgt voor adequate hulpmiddelen en training om onze prestaties op peil te houden.,Team niveau. Geef svp aan in hoeverre u het ermee eens of oneens bent - (TL4.3) Dienend leiderschap: De bedrijfsleider/manager stelt het team in staat om goed te presteren en wakkert de creativiteit aan.,Veerkracht factoren Organisatie niveau. Geef svp aan in hoeverre u het ermee eens of oneens bent - (OL1.1) Middelen: Onze organisatie heeft weinig schulden en veel liquide middelen.,Veerkracht factoren Organisatie niveau. Geef svp aan in hoeverre u het ermee eens of oneens bent - (OL1.2) Business models Mijn organisatie herziet regelmatig onze business modellen,Veerkracht factoren Organisatie niveau. Geef svp aan in hoeverre u het ermee eens of oneens bent - (OL1.3) Terugverdientijd: In onze organisatie hebben afschrijvingen een grote impact.,Veerkracht factoren Organisatie niveau. Geef svp aan in hoeverre u het ermee eens of oneens bent - (OL1.4) Financiering: Externe financiering is nodig om ons bedrijf draaiende te houden.,Veerkracht factoren Organisatie niveau. Geef svp aan in hoeverre u het ermee eens of oneens bent - (OL1.5) Vaste kosten: Onze organisatie houdt deze laag om wendbaar te kunnen zijn.,Veerkracht factoren Organisatie niveau. Geef svp aan in hoeverre u het ermee eens of oneens bent - (OL1.6) Naleving van wet- en regelgeving: Onze organisatie heeft de risico's op het gebied van naleving van wet- en regelgeving beperkt.,Veerkracht factoren Organisatie niveau. Geef svp aan in hoeverre u het ermee eens of oneens bent - (OL1.7) Mogelijkheid om op/af te schalen: Mijn organisatie is afhankelijk van freelancers om op of af te schalen.,Organisatie niveau. Geef svp aan in hoeverre u het ermee eens of oneens bent - (OL2.1) Structurele flexibiliteit: In onze organisatie kunnen middelen worden herverdeeld wanneer dat nodig is.,Organisatie niveau. Geef svp aan in hoeverre u het ermee eens of oneens bent - (OL3.1) Eigenaarschap: Ik denk dat in onze organisatie de werknemers zich verantwoordelijk voelen voor de kwaliteit van de geleverde goederen en diensten.,Organisatie niveau. Geef svp aan in hoeverre u het ermee eens of oneens bent - (OL3.2) Besluitvorming: Ik denk dat de besluitvorming in onze organisatie goed geregeld is.,Organisatie niveau. Geef svp aan in hoeverre u het ermee eens of oneens bent - (OL3.3) Werving en behoud: Mijn organisatie is in staat om talent aan te trekken en te behouden.,Organisatie niveau. Geef svp aan in hoeverre u het ermee eens of oneens bent - (OL4.1) Strategie bepaling: Directe concurrentie met andere bedrijven is essentieel voor succes.,Organisatie niveau. Geef svp aan in hoeverre u het ermee eens of oneens bent - (OL4.2) Portefeuillebeheer: Mijn organisatie spreidt risico's door portefeuillespreiding.,Organisatie niveau. Geef svp aan in hoeverre u het ermee eens of oneens bent - (OL4.3) Bedrijfsprofessionalisering: De mogelijkheid om op te schalen is voor onze organisatie essentieel voor succes.,Organisatie niveau. Geef svp aan in hoeverre u het ermee eens of oneens bent - (OL6.1) Beschikbaarstelling van middelen: Het opbouwen van een netwerk van partnerships is essentieel voor succes.,Organisatie niveau. Geef svp aan in hoeverre u het ermee eens of oneens bent - (OL6.2) Afstemming van doelen: In moeilijke tijden helpen industriepartners elkaar om het probleem op te lossen.,Organisatie niveau. Geef svp aan in hoeverre u het ermee eens of oneens bent - (OL7.1) Marktbewustzijn: Onze organisatie is voortdurend op zoek naar nieuwe marktkansen.,Organisatie niveau. Geef svp aan in hoeverre u het ermee eens of oneens bent - (OL7.2) Onze organisatie is sterk afhankelijk van innovatie.,Organisatie niveau. Geef svp aan in hoeverre u het ermee eens of oneens bent - (OL7.3) Onze organisatie is sterk afhankelijk van de kwaliteit van haar producten.,Organisatie niveau. Geef svp aan in hoeverre u het ermee eens of oneens bent - (OL7.4) Onze organisatie is sterk afhankelijk van een internationale handelsmentaliteit.,Organisatie niveau. Geef svp aan in hoeverre u het ermee eens of oneens bent - (OL7.5) Onze organisatie is sterk afhankelijk van haar commercieel bewustzijn.,Organisatie niveau. Geef svp aan in hoeverre u het ermee eens of oneens bent - (OL7.6) Onze organisatie is sterk afhankelijk van haar vindingrijkheid.,"Veerkracht factoren netwerk niveau. Geef svp aan in hoeverre u het ermee eens of oneens bent - (NL1.1) Complementaire kennis: In onze organisatie vertrouwen we op de kennis van externe professionals (b.v. consultants, freelancers, enz.) wanneer ons interne team specifieke kennis of expertise mist om projecten te voltooien.","Veerkracht factoren netwerk niveau. Geef svp aan in hoeverre u het ermee eens of oneens bent - (NL1.2) Interne en externe samenwerking: In onze organisatie werken onze interne teams samen met externe bedrijven en/of professionals (b.v. de lokale overheid, bedrijfsnetwerk/ecosysteem) om projecten te voltooien.",Veerkracht factoren netwerk niveau. Geef svp aan in hoeverre u het ermee eens of oneens bent - (NL1.3) Projectstructurering en -management: In onze organisatie beschikken wij over mensen en processen om een adequate structurering en management van projecten mogelijk te maken.,Veerkracht factoren netwerk niveau. Geef svp aan in hoeverre u het ermee eens of oneens bent - (NL1.5) Integratiemechanismen: Onze organisatie verzamelt nieuwe kennis door samenwerking met externe partners.,Veerkracht factoren netwerk niveau. Geef svp aan in hoeverre u het ermee eens of oneens bent - (NL1.6) Kernteam van professionals: Onze organisatie maakt gebruik van een netwerk van experts die op projectbasis specifieke problemen kunnen helpen oplossen en bekend staan om hun expertise.,Veerkracht factoren netwerk niveau. Geef svp aan in hoeverre u het ermee eens of oneens bent - (NL1.7) Netwerk van professionals: In onze organisatie hebben we een netwerk van professionals die ons op projectbasis kunnen helpen bij het oplossen van specifieke problemen en bekend staan om hun expertise.,"Veerkracht factoren netwerk niveau. Geef svp aan in hoeverre u het ermee eens of oneens bent - (NL1.8) Langetermijn partnerships: In onze organisatie zetten we langetermijn samenwerkingen op binnen ons netwerk (b.v. met de lokale overheid, beleidsmakers, bedrijfsnetwerk, enz.).","Netwerk niveau. Geef svp aan in hoeverre u het ermee eens of oneens bent - (NL2.0) Uitbesteding: Onze organisatie besteedt regelmatig werk uit (lokaal, nationaal of internationaal).",Netwerk niveau. Geef svp aan in hoeverre u het ermee eens of oneens bent - (NL2.3) Samenwerkingsnetwerken: Onze organisatie beschikt over samenwerkingsnetwerken (samenwerking binnen een bedrijfsecosysteem) die haar voortbestaan en duurzaamheid mogelijk maken.,Netwerk niveau. Geef svp aan in hoeverre u het ermee eens of oneens bent - (NL2.4) Complementair team: Onze  organisatie beschikt over een complementair toeleverings netwerk ten behoeve van haar productie.,Netwerk niveau. Geef svp aan in hoeverre u het ermee eens of oneens bent - (NL2.5) Taakafspraken: In onze organisatie hebben we taakafspraken om werknemers en freelancers in staat te stellen bedrijfsprocessen en kwaliteitsnormen te volgen.,Netwerk niveau. Geef svp aan in hoeverre u het ermee eens of oneens bent - (NL 3.1) Evolutionary computation (probleemoplossende algoritmen die zich automatisch aanpassen aan verandering) :Onze organisatie is sterk afhankelijk van Evolutionary Computation.,Netwerk niveau. Geef svp aan in hoeverre u het ermee eens of oneens bent - (NL 3.1) Evolutionary computation (probleemoplossende algoritmen die zich automatisch aanpassen aan verandering) :Onze organisatie is sterk afhankelijk van Evolutionary Computation. - Text,Netwerk niveau. Geef svp aan in hoeverre u het ermee eens of oneens bent - (NL 3.2) Blockchain(een beveiligde gedistribueerde opslag beheerd door een peer-to-peer netwerk) : Onze organisatie is sterk afhankelijk van Blockchain.,Netwerk niveau. Geef svp aan in hoeverre u het ermee eens of oneens bent - (NL3.3) Chaos engineering(gedistribueerde systemen die organisaties in staat stellen om te profiteren van chaos) : Onze organisatie is sterk afhankelijk van Chaos Engineering.,"Netwerk niveau. Geef svp aan in hoeverre u het ermee eens of oneens bent - (NL3.4) DevOps (Hulpmiddelen en technieken om de afdelingen Development (Dev), Quality Assurance en Operations (Ops) te integreren)  : Onze organisatie is sterk afhankelijk van DevOps.",Netwerk niveau. Geef svp aan in hoeverre u het ermee eens of oneens bent - (NL3.5) Redundancy (Meerdere middelen/systemen hebben om dezelfde functie uit te voeren)  : Mijn organisatie is sterk afhankelijk van redundancy,Netwerk niveau. Geef svp aan in hoeverre u het ermee eens of oneens bent - (NL3.6) Distributed ICT (Informatie en communicatie technologie - ecosystemen van autonome entiteiten die met elkaar en met de omgeving in wisselwerking staan.) :Mijn organisatie is sterk afhankelijk van Distributed ICT (Information and Communication Technology).,Netwerk niveau. Geef svp aan in hoeverre u het ermee eens of oneens bent - (NL3.7) Mijn organisatie is sterk afhankelijk van externe data-opslag (externe opslag van data om risico van uitval te reduceren).,Netwerk niveau. Geef svp aan in hoeverre u het ermee eens of oneens bent - (NL3.8) Multiagent-Based Modelling (een aanpak om intelligente autonome en gedistribueerde oplossingen te brengen en hun effectiviteit te testen): Mijn organisatie is sterk afhankelijk van Multiagent-Based Modelling.,"Netwerk niveau. Geef svp aan in hoeverre u het ermee eens of oneens bent - (NL3.9) Micro services(een manier om applicaties te ontwerpen met flexibele structuren met voordelen van zwakke schakels, redundantie, modulariteit, diversiteit en schaalbaarheid die de kwetsbaarheid van systemen aanzienlijk kunnen beperken.) : Mijn organisatie is sterk afhankelijk van microservices.","Netwerk niveau. Geef svp aan in hoeverre u het ermee eens of oneens bent - (NL 3.10) Cloud computing (levering van computerresources via internet om producten en services die klanten gebruiken te hosten op externe servers, in plaats van eigen interne systemen) : Mijn organisatie is sterk afhankelijk van Cloud computing.",Netwerk niveau. Geef svp aan in hoeverre u het ermee eens of oneens bent - (NL3.11) Technologische hedging: Mijn organisatie is sterk afhankelijk van software.,Resilience factors individual level. Please answer to which extent you agree or disagree: - (IL1.1) - Job demands: I regularly  feel exhausted after a working week,Resilience factors individual level. Please answer to which extent you agree or disagree: - (IL1.1) - Burn-out rate:In our organisation we have a pleasant working climate,Resilience factors individual level. Please answer to which extent you agree or disagree: - (IL1.2) - Stressors: I regularly feel job insecurity.,Resilience factors individual level. Please answer to which extent you agree or disagree: - (IL1.2) - Stressors: I feel pressure to work outside work hours and do not feel free to leave work at the normal time.,Resilience factors individual level. Please answer to which extent you agree or disagree: - (IL1.2) - Stressors: In our organisation we have a competitive culture.,Resilience factors individual level. Please answer to which extent you agree or disagree: - (IL1.3) - Job resources: I see plenty of opportunities for personal growth.,Resilience factors individual level. Please answer to which extent you agree or disagree: - (IL1.3) - Job resources: In our organisation I regularly get constructive feedback.,Resilience factors individual level. Please answer to which extent you agree or disagree: - (IL1.3) - Job resources: In our organisation I have many different skills I can use in my work.,Resilience factors individual level. Please answer to which extent you agree or disagree: - (IL1.3) - Job resources: Within our organisation I feel a lot freedom to perform my tasks.,"Individual level. Please answer to which extent you agree or disagree: - (IL2.1) - Personality characteristics: I have a healthy sense of humor, this helps to keep calm in difficult circumstances.","Individual level. Please answer to which extent you agree or disagree: - (IL2.1) - Personality characteristics: I have an optimistic mind, this helps to keep a calm in difficult circumstances.",Individual level. Please answer to which extent you agree or disagree: - (IL2.1) - Personality characteristics: In stressful situations I dare to voice my opinion.,Individual level. Please answer to which extent you agree or disagree: - (IL3.1) - Social Skills: I feel comfortable in maintaining my social network inside and outside the company.,Individual level. Please answer to which extent you agree or disagree: - (IL3.2) - Cognitive Skills: I am capable of keeping up with the knowledge development in my profession.,Individual level. Please answer to which extent you agree or disagree: - (IL3.3) - Professional Skills: I feel I have the time I need to perform my tasks.,Individual level. Please answer to which extent you agree or disagree: - (IL4.1) - Sense of purpose: I feel I contribute to company's overall succes.,Individual level. Please answer to which extent you agree or disagree: - (IL4.2) - Gratitude: I feel I am getting the recognition from my organisation for my work.,Individual level. Please answer to which extent you agree or disagree: - (IL4.3) - Humility: I feel we all are equally important to the company's success,Individual level. Please answer to which extent you agree or disagree: - (IL4.4) - Hope: I believe we have a prosperous future for our company.,Individual level. Please answer to which extent you agree or disagree: - (IL4.5) - Career orientation: I have a focus on personal career development.,Individual level. Please answer to which extent you agree or disagree: - (IL5.1) - Positive relationships trust/collaboration: I trust my colleagues and like to collaborate,Individual level. Please answer to which extent you agree or disagree: - (IL5.2) - Social Support from private circle: I feel my family/friends support me in my career,Individual level. Please answer to which extent you agree or disagree: - (IL6.1) - Creating a positive work environment: My CEO is able to create a positive working environment.,Individual level. Please answer to which extent you agree or disagree: - (IL6.2) - Introducing alternative strategies: My CEO is able to come up with alternative strategies when we are facing difficulties,Individual level. Please answer to which extent you agree or disagree: - (IL6.3) - Competence to choose appropriate strategies: My CEO is able to choose the right strategy in the event of threats major changes in our business.,Resilience factors team level. Please answer to which extent you agree or disagree: - (TL1.1) - Collective positive emotions: My team always looks on the bright side of life.,Resilience factors team level. Please answer to which extent you agree or disagree: - (TL1.2) - Shared beliefs: In my team we have a shared vision in line with company goals.,Resilience factors team level. Please answer to which extent you agree or disagree: - (TL1.3) - Culture of Joy: In my team we also know how to enjoy some time together.,Resilience factors team level. Please answer to which extent you agree or disagree: - (TL1.4) - Cohesiveness: In my team we have strong bond.,Resilience factors team level. Please answer to which extent you agree or disagree: - (TL1.5) - Cooperation: In my team we have a shared responsibility for the results.,Resilience factors team level. Please answer to which extent you agree or disagree: - (TL1.6) - Creative problem solving: In my team we are able to come up with creative solutions.,Resilience factors team level. Please answer to which extent you agree or disagree: - (TL1.7) - Structure: We have a team with a clear formalised task division and quality control system.,Team level. Please answer to which extent you agree or disagree: - (TL2.1) - Social support climate: In my team it is safe to ask for help. This culture is actively supported.,Team level. Please answer to which extent you agree or disagree: - (TL2.3) - Collectively managing adversity and setbacks: In my team we collectively manage problems and challenges.,"Team level. Please answer to which extent you agree or disagree: - (TL2.4) - Team coordination:  In my team we have fixed standards, checklists, guidebooks, resource matrices, debriefs.",Team level. Please answer to which extent you agree or disagree: - (TL3.1) - Business Acumen of Management: In my team we can rely on the business knowledge of our management.,Team level. Please answer to which extent you agree or disagree: - (TL3.3) - Skills complementarity: In my team we cover all skills needed to finish a job.,Team level. Please answer to which extent you agree or disagree: - (TL3.4) - Creative capability: In my team we are creative and we inspire each other.,Team level. Please answer to which extent you agree or disagree: - (TL4.1) - Providing adequate tools & training: Our team lead provides adequate tools and training to keep our performance up to standard.,Team level. Please answer to which extent you agree or disagree: - (TL4.3) - Servant leadership: My CEO enables the team to perform well and fuels creativity.,Resilience factors organization level. Please answer to which extent you agree or disagree: - (OL1.1) - Resources: Our organisation has a low levels of debt and high levels of cash on hand.,Resilience factors organization level. Please answer to which extent you agree or disagree: - (OL1.2) - Revenue models: Our organisation regularly reviews our business models.,Resilience factors organization level. Please answer to which extent you agree or disagree: - (OL1.3) - Payback period: In our organisation depreciation has a large impact.,Resilience factors organization level. Please answer to which extent you agree or disagree: - (OL1.4) - Funding: External funding is needed in order to keep our business going.,Resilience factors organization level. Please answer to which extent you agree or disagree: - (OL1.5) - Fixed Costs: Our organisation keeps these low in order to facilitate agility.,Resilience factors organization level. Please answer to which extent you agree or disagree: - (OL1.6) - Legal / Regulatory Compliance: Our organisation has mitigated legal and regulatory compliance risks.,Resilience factors organization level. Please answer to which extent you agree or disagree: - (OL1.7) - Scalability: Our organisation depends on freelancers to facilitate scaling up and down.,Organization level. Please answer to which extent you agree or disagree: - (OL2.1) - Structural flexibility: In our organisation resources can be reallocated when needed.,Organization level. Please answer to which extent you agree or disagree: - (OL3.1) - Ownership: I think that in our organisation employees feel responsible for the quality of goods and services delivered.,Organization level. Please answer to which extent you agree or disagree: - (OL3.2) - Decision making: I think that decision-making processes are well positioned in our organisation.,Organization level. Please answer to which extent you agree or disagree: - (OL3.3) - Recruitment & Retention: Our organisation is able to attract and retain talent.,Organization level. Please answer to which extent you agree or disagree: - (OL4.1) - Capture strategy: Direct competition with other companies is vital for success.,Organization level. Please answer to which extent you agree or disagree: - (OL4.2) - Portfolio management: My organisation spreads risks through portfolio diversification.,Organization level. Please answer to which extent you agree or disagree: - (OL4.3) - Business professionalisation: Scalability of my organisation is essential for success.,Organization level. Please answer to which extent you agree or disagree: - (OL6.1) - Resource provisioning: Building a network of partnerships is essential for success.,Organization level. Please answer to which extent you agree or disagree: - (OL6.2) - Goal alignment: In tough times industry partners help each other in order to solve the problem.,Organization level. Please answer to which extent you agree or disagree: - (OL7.1) - Market awareness: Our organisation is constantly looking for new market opportunities.,Organization level. Please answer to which extent you agree or disagree: - (OL7.2) - Dutch Entrepreneurship: Our organisation is highly dependent on innovation.,Organization level. Please answer to which extent you agree or disagree: - (OL7.3) - Dutch Entrepreneurship: Our organisation is highly dependent on the quality of its products.,Organization level. Please answer to which extent you agree or disagree: - (OL7.4) - Dutch Entrepreneurship: Our organisation is highly dependent on an international trading mindset.,Organization level. Please answer to which extent you agree or disagree: - (OL7.5) - Dutch Entrepreneurship: Our organisation is highly dependent on its commercial awareness.,Organization level. Please answer to which extent you agree or disagree: - (OL7.6) - Dutch Entrepreneurship: My organisation is highly dependent on its resourcefulness.,"Resilience factor network level. Please answer to which extent you agree or disagree: - (NL1.1) - Complementary Knowledge: In our organization, we rely on the knowledge of external professionals (e.g. consultants, freelancers, etc), when our internal team lacks specific knowledge/expertise to complete projects.","Resilience factor network level. Please answer to which extent you agree or disagree: - (NL1.2) - Internal and external collaboration: In my organization, our internal teams collaborate with external companies and or professionals (e.g. the local government, business network/ecosystem) to complete projects.",Resilience factor network level. Please answer to which extent you agree or disagree: - (NL1.3) - Project Structuring and Management: In my organization we have people and processes in place to enable an adequate project structuring and management.,Resilience factor network level. Please answer to which extent you agree or disagree: - (NL1.5) - Integration mechanisms: Our organization collects new knowledge by cooperation with external partners.,Resilience factor network level. Please answer to which extent you agree or disagree: - (NL1.6) - Core team of professionals: Our organization makes use of a network of experts who can help solve specific problems on a project basis and are known for their expertise.,Resilience factor network level. Please answer to which extent you agree or disagree: - (NL1.7) - Network of professionals: At our organization we have a network of professionals who can help us solve specific problems on a project basis and are known for their expertise.,"Resilience factor network level. Please answer to which extent you agree or disagree: - (NL1.8) - Long-term partnerships: At our organization we create long-term partnerships within our network (e.g. local government, policymakers, business network, etc).","Network level. Please answer to which extent you agree or disagree: - (NL2.0) - Outsourcing: Our organization outsources work locally, nationally or internationally on a regular basis.",Network level. Please answer to which extent you agree or disagree: - (NL2.1) - Local and global partnerships: Our organization has local and global partnerships in place to complete projects.,Network level. Please answer to which extent you agree or disagree: - (NL2.2) - Emergency relief networks: Our organization has emergency relief networks (to reinstate or ensure the continuation of business operations) in place to safeguard its strategic and operational goals.,Network level. Please answer to which extent you agree or disagree: - (NL2.3) - Collaborative networks: Our organization has collaborative networks (collaboration within a business ecosystem) that enable its survival and sustainability.,Network level. Please answer to which extent you agree or disagree: - (NL2.4) - Complementary team: My organization has a complementary supply chain network to facilitate its productivity.,Network level. Please answer to which extent you agree or disagree: - (NL2.5) - Task regulation: In our organization we have task regulation in place to enable employees and freelancers to follow company processes and quality standards.,Network level. Please answer to which extent you agree or disagree: - (NL3.1) - Evolutionary computation (problem-solving algorithms self- adapting to change): Our organisation is highly dependant on evolutionary computation,Network level. Please answer to which extent you agree or disagree: - (NL3.2) - Blockchain (a secure distributed storage managed by a peer-to-peer network): Our organisation is highly dependent on Blockchain.,Network level. Please answer to which extent you agree or disagree: - (NL3.3) - Chaos engineering (distributed systems to create antifragility by evolving systems to survive the chaos); Our organisation is highly dependent on Chaos Engineering.,"Network level. Please answer to which extent you agree or disagree: - (NL3.4) - DevOps (Tools and techniques to integrate the development (Dev), quality assurance, and operations (Ops) departments): Our organisation is highly dependent on DevOps.",Network level. Please answer to which extent you agree or disagree: - (NL3.5) - Redundancy (Having multiple assets and systems to perform the same function): Our organisation is highly dependent on redundancy.,Network level. Please answer to which extent you agree or disagree: - (NL3.6) - Distributed ICT (Information Communication Technology - ecosystems of autonomous entities interacting with each other and environment.): Our organisation is highly dependent on Distributed ICT (Information and Communication Technology).,Network level. Please answer to which extent you agree or disagree: - (NL3.7) - External Data storage (data storage to reduce risk system downtime): Our organisation is highly dependent on external data storage.,Network level. Please answer to which extent you agree or disagree: - (NL3.8) - Multiagent-based modelling (an approach to bring intelligent autonomous and distributed solutions and test their effectiveness): Our organisation is highly dependent on Multiagent-Based Modelling.,"Network level. Please answer to which extent you agree or disagree: - (NL3.9) - Microservices (a way for architecting applications with flexible structures with benefits of weak links, redundancy, modularity, diversity, and scalability that can significantly limit the vulnerability of systems.): Ourorganisation is highly dependent on microservices.","Network level. Please answer to which extent you agree or disagree: - (NL3.10) - Cloud Computing (highly redundant computing, and data storage enabling diversity to facilitate continuity in case of system downtime.) Our organisation is highly dependant on Cloud computing.","Network level. Please answer to which extent you agree or disagree: - (NL3.11) - Technological hedging (backups of systems and processes, systematic contingency planning, information technology upgrades): Technological hedging: Our organisation is highly dependent on software.","Toestemmingsformulier voor onderzoeksproject Verveci.
Ik ga akkoord met deelname aan dit onderzoeksproject. Ik heb dit toestemmingsformulier en het informatieblad gelezen en heb de gelegenheid gehad om er vragen over te stellen. Ik begrijp dat ik niet verplicht ben om aan dit project deel te nemen. Ik begrijp dat ik het recht heb om me op elk moment uit dit project terug te trekken. Ik ga ermee akkoord dat mijn antwoorden worden gebruikt voor onderzoek, op voorwaarde dat mijn privacy wordt gerespecteerd.
Als u akkoord gaat, vul dan svp uw naam in het onderstaande vak in",Welke categorie beschrijft het best de kernactiviteiten van uw organisatie,Weet u de SBI code waarmee uw organisatie geregistreerd is bij de KvK,Wat is uw rol in de organisatie?,Heeft uw organisatie externe bestuurders / bewindvoerders in de bestuursraad? Ja / Nee / Weet niet,"Wat is het gemiddelde jaarlijkse personeelsverloop van uw organisatie in de afgelopen 5 jaar? – 0-5%, 6-10%, 11-20%, 21-40%, >40%",Welke van de volgende kenmerken beschrijft uw organisatie het best? – Met winstoogmerk / Zonder winstoogmerk,"Wat is de gemiddelde jaarlijkse omzetgroei van uw organisatie in de afgelopen 5 jaar? Voor elk jaar wordt dit berekend als de jaarlijkse omzetstijging van uw organisatie gedeeld door de omzet van het jaar daarvoor.  – Minder dan 0% / 1-10% / 11-
30% / 31-100% / 101%+ / Weet niet","Wat is de gemiddelde jaarlijkse winst/omzetverhouding van uw organisatie in de afgelopen 5 jaar? Voor elk jaar wordt dit 
berekend als de nettowinst van uw organisatie vóór belasting gedeeld door de totale omzet. – Minder dan 0% / 0-5% / 6-10% / 11-20%, >20%+ / Weet niet.",In de afgelopen 5 jaar zijn de gemiddelde kosten van personeelstraining per jaar gestegen / gedaald / niet veranderd.,In de afgelopen 5 jaar zijn de jaarlijkse investeringen in R&D gestegen / gedaald / niet veranderd.,"Wat is het gemiddelde jaarlijkse rendement op investeringen (ROI) van uw organisatie over de afgelopen 5 jaar? Voor elk jaar wordt dit berekend als de winst van uw organisatie na belasting, gedeeld door de activa minus de passiva.  – Minder dan 0 / 0-5 / 6-10 / 11-20 / >20 / Weet niet",Met hoeveel is het inkomstenbudget van uw organisatie de afgelopen 5 jaar gemiddeld per jaar gestegen? – Minder dan 0% /  1-10% /  11-30% /  31-100% /  101%+ /  Weet niet,Wat is het gemiddelde exploitatieoverschot van uw organisatie als percentage van de totale inkomsten over de afgelopen 5 jaar?  – 0-5% /  6-10% / 11-20% /  >20% / Weet niet,"Consent form for Verveci research project .
I agree to participate in this research project. I have read this consent form and the information sheet and had the opportunity to ask questions about them. I understand that I am under no obligation to take part in this project. I understand that I have the right to withdraw from this project at any stage. I agree to my answers  being used for research, on condition that my privacy is respected.
If you agree please fill in your name in box below",Which category best describes the core activities of your company,What is your role within the organization?,Does your organisation have external directors/trustees on its governing board?,What is your organisation's average annual staff turnover over the last 5 years?,Which of the following best describes your organisation?,"What is your organisation’s average annual sales growth rate over the last 5 years? For each year, this is 
calculated as your organisation’s annual increase in sales divided by the previous year’s sales.","What is your organisation’s average annual profit-to-sales ratio over the last 5 years? For each year, this is 
calculated as your organisation’s net profit before tax divided by the total sales.",Over the last 5 years the average costs of staff training per year  have increased / decreased / did not change.,Over the last 5 years the annual investment in R&D  has increased / decreased / did not change.,"Over the last 5 years the amount of new product introductions per year have increased, decreased, did not change","What is your organisation’s average annual return on investment (ROI) over the last 5 years? For each year, this is 
calculated as your organisation’s profit after tax, divided by its assets minus its liabilities.","By how much, on average, has your organisation's income budget increased each year, over the last 5 years?",What is your organisation's average operating surplus as a percentage of its total income over the last 5 years?
